name|contact|address|zone|nearby_station|introduction|refund_information|facility_information|naver_object_id|image_url|image_url|image_url|image_url|image_url|image_url|image_url|image_url|image_url|image_url|image_url|image_url|image_url|image_url|image_url|image_url|image_url|image_url|image_url|image_url
이지댄스 강남점|02-552-9979|서울시 강남구 역삼동 817-36 플라타너스 4층|강남|강남역, 신논현역|"2003년 1월에 개관하여 현재까지 500.000여명의 회원들이 이지댄스 마니아층으로 형성되어 있습니다. 
재즈,K-POP방송,힙합(걸스),클럽,나이트댄스 등 취미와 운동을 병행할 수 있는 기초,초급,취미반에 이어 다이어트,몸치탈충,개인(그룹)레슨,자기개발이 필요한 분들을 위한 특정 맞춤형 프로그램이 있습니다. 또는 실용댄스(힙합 or 스트릿),순수무용(현대,발레기초)을 통한 전문인과정(입시,오디션,지도자)으로 진행중입니다. 최상의 생활에너지를 창조하고 대한민국 1% 댄스학원에서 편안하고 휴식처와 같은 공간이 될 것을 약속 드리며 회원님들께 받은 사랑만큼 더욱 노력하는 이지댄스 강남점이 되겠습니다."|사용전 환불 전액 가능. 사용후 환불 규정은 다음과 같습니다. 1달 할인받은 금액으로 등록을 하였을 때, 듣는 도중 환불을 신청하면 수강하신 수업들을 일별 금액(원가로)으로 계상하여 나머지 금액을 돌려드립니다. |toilet, fitting_room, locker|11568543||||||||||||||||||||
스마일라이프|02-3452-1517|서울시 강남구 역삼동 풍림빌딩 B1 아케이드|강남|역삼역|"SmileLife의 모든 악기 강습은 누구나 즐겁고 쉽게 100% 소화해 낼 수 있습니다. 누구나 행복한 삶을 꿈꾸며 시작된 인생이, 반복되고 지친 일상과 나만의 개인 시간 부족으로 내 삶이 아닌 것 같은 지금~!!!
어릴 때부터 막역히 해보고만 싶었던 음악… 악기, 밴드합주, 공연… 
꼭 경험 해보고 싶었던 행복, 짜릿한 순간을 느끼고 원하는 여러분들을 위해 누구나 부담 없이 편하게 즐길 수 있는 음악 공간을 마련했습니다.
스마일 라이프는 직장인, 연령 있으신 성인 분들에게만 포커스를 맞추어 수업 내용을 개선하고, 더욱 더 쉽고 부담 없이 음악에 저절로 빠져 들 수 있도록 항상 노력하고 좀 더 쉬운 1:1 개인 맞춤형 수업을 통해 책임 강습을 하고 있습니다.
성인, 직장인, 모두가 음악으로 하나가 되고, 좀 더 행복한 삶을 누릴 때까지 Smile life는 항상 끊임없이 노력하고 나아가겠습니다. 
"|첫 수업 전까지 전액 환불, 수업의 절반 과정 이수 후 환불 불가|toilet, instrument_rental, practice_room|13418971||||||||||||||||||||
매치스튜디오|02-561-8629|서울시 강남구 역삼동 637-23 장현빌딩 5층|강남|역삼역|"매치 스튜디오는 직장인들을 위해 취미이면서도 전문 뮤지션들로부터 제대로 배울 수 있는 기회를 제공합니다. 
각종 방송에도 소개된 나선형 스타일의 교육방식을 국내 최초로 개발하여 수강생들의 연주실력을 향상시키는 노하우를 가지고 있습니다. 
지리적 조건이 좋은 역삼에 위치하여 직장인들이 퇴근 후 부담없이 방문할 수 있으며 동시에 바쁜 일정에 맞춰 스케쥴을 매번 조정할 수 있습니다.
또한, 매치스튜디오는 직장인 밴드를 장려하기 위해 주기적으로 직장인 수강생들 간의 합주를 클럽이나 공연장에서 지속적으로 개최하고 있습니다.
특히, 1년에 한 번 12개국의 학원들과 MOU를 체결하여 세계적인 뮤지션(나는 가수다 출연 세션)들을 오픈 클래스를 통하여 만나 보실 수 있는 기회를 제공합니다. 뿐만 아니라, 악기 판매 업체 스쿨뮤직과 MOU를 통해 할인 혜택 제공을 해드립니다."|"기본적으로 교육청 환불 규정에 준수
- 수강 전까지 전액환불 가능
- 수강 이후부터는 남은 수강 회수를 계산하여 나온 금액에 10%수수료를 제하고 환불"|toilet, instrument_rental, practice_room|11869806||||||||||||||||||||
로코망고|070-8832-5534|서울시 강남구 역삼동 648-3 아로마빌 2층|강남|역삼역|"로코망고 Company는 하와이 전통악기 우쿨렐레 회사로써 새롭고 특별함을 원하는 사람들을 위하여 다양한 컨텐츠를 만들고 있습니다. 우쿨렐레 제작에서 부터 교육,공연,출판 해외무역과 재능기부등 트로피컬 아일랜드의 문화를 전달하는데에 앞장서고 있습니다.
수강생을 위한 혜택으로는 우쿨렐레를 아직 장만하지못한 수강생을 위하여 수업시간에 악기를 대여해 드리고 있습니다. 또한 로코망고에서 우쿨렐레를 구매하실 경우 10% 할인된 가격에 구매가 가능하며, 구매한 우쿨렐레에 대한 체크 및 검수, 무료 셋팅이 가능합니다.
한달에 한번 매달 금요일 ""알로하 프라이데이를 통하여 수업과 별개로 관심이 있는 수강생들에게 오픈 보강 클래스도 진행하고 있습니다.
 로코망고에서는 레벨원/레벨투/레벨쓰리에 맞춰 우쿨렐레 교재가 제공됩니다. 레벨마다 첫시간에 나눠 드리며, 우쿨렐레 교재에 있는 곡 이외의 프린트물이 제공 될 수 있습니다. LV.4이상의 강좌에서는 담당강사와의 수업내용 조율 후 진쟁되기 때문에 교재가 따로 준비됩니다.
"|"기본적으로 교육청 환불 규정에 준수
- 수강 전까지 전액환불 가능
- 수강 이후부터는 남은 수강 회수를 계산하여 나온 금액에 10%수수료를 제하고 환불"|toilet, instrument_rental, practice_room|32382958||||||||||||||||||||
워너비댄스아카데미|02-515-8255|서울시 강남구 신사동 592-4 B1|강남|압구정역|워너비댄스아카데미는 차별화된 커리큘럼과 체계적인 교육시스템을 갖추고 있으며, 전문 강사진들의 쉽고 재미있는 수업을 통해 퇴근 후 직장인들의 스트레스 해소, 취미활동, 운동, 다이어트, 댄스실력 향상 등의 효과를 볼 수 있습니다. 취미단체반은 자유이용 쿠폰제 시스템으로 바쁜 직장인들의 시간적 부담을 최소화하고 적성이나 취향에 맞는 다양한 수업을 교차 수강할 수 있다는 장점이 있습니다. 또한 배우고 끝나는 수업이 아니라 영상촬영을 통하여 변화하는 과정을 기록하고, 자신의 장.단점을 파악하여 개선할 수 있습니다. 1년마다 쇼케이스를 개최하여 무대공연을 경험하고 소중한 추억을 쌓을 수 있습니다.|"기본적으로 교육청 환불 규정에 준수
- 수강 전까지 전액환불 가능
- 수강 이후부터는 남은 수강 회수를 계산하여 나온 금액에 10%수수료를 제하고 환불"||21059767||||||||||||||||||||
강남기타학원|02-591-7784|서울시 서초구 논현동 201-1 용천빌딩 4층|강남|강남역, 신논현역|"1. 기타 전문 아카데미입니다.
강남기타아카데미는 기타 레슨 아카데미로 기타 전공 강사가 기초부터 고급 테크닉까지 체계적으로 친절하게 지도하여 드립니다?? [교육청 등록 인허가 제 11502호]
강사:???ITALY A.I.D.M College(Accademia Internazionale Di Musica. Roma) Guitar Major(Diploma) 
GIT Guitar Professional Certificate(short training course)
백석대학교 대학원 실용음악과 기타전공 석사

2. 취미에서 프로까지~
강남기타아카데미는 취미로 배우는 분들이 많이 찾는 학원입니다.
취미 기타 레슨은 아래의 조건을 충족시킬 수 있어야 합니다.

1) 기타 강습이 실질적이어야 합니다.
(2014년 현재, 가장?많이 사용하는?기타 연주법 위주로?체계적으로 레슨합니다.)
2) 재미있어야 합니다.
( 강습이 재미있어야 열정 또한 생기기 때문에 완성도,테크닉,흥미면에서 검증을 거친 곡들로만 진행하며, 초중급 과정엔 학생이 다루기 원하는 곡도 포함하여 레슨합니다.)
3) 실력이 향상되어야 합니다. ( 매일 한가지라도 새로운 테크닉을 배워갈 수 있도록 지도합니다 )

강남기타아카데미는 회원들이 취미에서 시작하여 프로뮤직션으로도 진출할 수 있도록 중급, 중상급, 중고급, 고급, 프로입문, 프로심화 과정까지 수준있는 커리큘럼을 구비하고 있습니다.

3. 경제적인 기타강습비

강남기타아카데미는 회원들의 레슨비 부담을 줄여주기 위해 레슨비를 저렴하게 책정하고 있습니다."|"기본적으로 교육청 환불 규정에 준수
- 수강 전까지 전액환불 가능
- 수강 이후부터는 남은 수강 회수를 계산하여 나온 금액에 10%수수료를 제하고 환불"|toilet, instrument_rental, practice_room, parking_lot||/static/classes/company/music/gangnam_guitar_thumb.png|/static/classes/company/music/gangnam_guitar_1.png|/static/classes/company/music/gangnam_guitar_2.png|/static/classes/company/music/gangnam_guitar_3.png|/static/classes/company/music/gangnam_guitar_4.png|/static/classes/company/music/gangnam_guitar_5.png|/static/classes/company/music/gangnam_guitar_6.png|/static/classes/company/music/gangnam_guitar_7.png|/static/classes/company/music/gangnam_guitar_8.png|||||||||||
제이댄스아카데미|070-7607-5775|서울시 강남구 역삼동 830-22 고명빌딩 B1|강남|강남역, 신논현역|"실용댄스전문학원 제이댄스아카데미에서는 다양한 장르의 댄스를 접할 수 있으며, 취미는 물론 전문적인 수준까지 제대로 배우실 수 있습니다.

팝핀/비보잉/하우스댄스/힙합/걸스힙합/재즈댄스/8090댄스/K-POP댄스/라인댄스/클럽댄스/노래방댄스 등 다양한 클래스를 경험해볼 수 있으며, 각 분야별 실력파 강사진 보유로 내실있는 실력 향상을 도모합니다. 

강남역 인근에 위치하여 교통이 편리하며, 쿠폰제 운영으로 본인 스케줄에 맞춰 원하는 시간에 자유롭게 수강이 가능합니다. 쿠폰제 운영은 또한 여러 클래스를 실제로 경험해 본 후 자신에게 맞는 클래스를 선택하여 수강할 수 있게 도와줍니다.

또한, 수강생들의 실력 향상 및 동기부여를 위해 수강생 공연을 진행하며, 원하는 경우 공연팀 활동 및 각종 대외 활동 참여가 가능합니다. "|"기본적으로 교육청 환불 규정에 준수
- 수강 전까지 전액환불 가능
- 수강 이후부터는 남은 수강 회수를 계산하여 나온 금액에 10%수수료를 제하고 환불"|toilet, shower_stall, practice_room, fitting_room, locker|||||||||||||||||||||
라브우기 기타&우쿨렐레 학원|070-7535-0643|서울시 서초구 서초동 1670-4 3층, 4층|강남|교대역|"악기 대여 GOOD!
서울 최저가 GOOD!
동호회식 그룹레슨으로 친목과 실력을 함께 GOOD!
올여름엔 악기메고 여행 떠나요~~~~~~

라브우기는 직장인 학생들을 대상으로 하는 취미 전문 학원입니다.
통기타와 우쿨렐레 수업이 있으며, 동호회식 그룹레슨으로 다과회, 회식, 공연, 등등 
다양한 친목 프로그램과 함께 쉽고 재밌는 수업을 하고 있어요!
“그룹레슨은 자세하게 배울수 없다“라는  편견을 깨기 위해 강사님이 한분한분 손모양부터 자세, 연주법까지 마치 개인레슨처럼 신경 써 주신답니다~ 
악기를 전혀 몰라도 음악적 지식이 전혀 없더라도 상관없어요!
화려하고 큰 학원 아니지만 마치 대학시절 동아리를 연상시키는 소소함과 편안함이 있어
부담없이 오실수 있어요^^
통기타와 우쿨렐레로 좋은 인연도 만들고 힐링하러 오세요~~  "|"수업 시작 전까지 전액 환불가능
수업 시작 이후부터는 남은 수강횟수를 계산 하여 나온 금액 환불
※ 수강 취소시 주의 사항
예약 취소는 최소 수업 시작 2일전에 연락주세요"|practice_room, instrument_rental, toilet|32397954||||||||||||||||||||
